{
  "schema_version": 1,
  "name": "power-on corner exit",
  "duration_s": 6.0,
  "timestep_s": 0.002,
  "integrator": "rk4",
  "initial_state": {
    "position_x_m": 0.0,
    "position_y_m": 0.0,
    "yaw_rad": 0.0,
    "vx_m_s": 20.0,
    "vy_m_s": 0.0,
    "yaw_rate_rad_s": 0.0
  },
  "steering_profile": {
    "type": "ramp",
    "initial_value": 0.0,
    "final_value": 0.035,
    "start_time_s": 0.0,
    "duration_s": 1.5
  },
  "throttle_profile": {
    "type": "ramp",
    "initial_value": 0.0,
    "final_value": 1.0,
    "start_time_s": 2.0,
    "duration_s": 2.0
  },
  "brake_profile": {
    "type": "constant",
    "value": 0.0
  }
}
