{
  "schema_version": 1,
  "name": "Step steer",
  "duration_s": 8.0,
  "timestep_s": 0.002,
  "integrator": "rk4",
  "initial_state": {
    "position_x_m": 0.0,
    "position_y_m": 0.0,
    "yaw_rad": 0.0,
    "vx_m_s": 20.0,
    "vy_m_s": 0.0,
    "yaw_rate_rad_s": 0.0
  },
  "steering_profile": {
    "type": "step",
    "initial_value": 0.0,
    "final_value": 0.02,
    "start_time_s": 1.0
  },
  "throttle_profile": {
    "type": "constant",
    "value": 0.0
  },
  "brake_profile": {
    "type": "constant",
    "value": 0.0
  }
}
